LINE NO,ITEM,COUPA PARTNUMBER,VENDOR NAME,DESCRIPTION,ON HAND,TO LOCATION,IQC REQUIRED,QUANTITY,COC REQUIRED,UNITS,INVENTORY DETAIL,LABEL COUNT,PRINT STATUS,OPTIONS,RATE,CURRENCY,DEPARTMENT,CLASS,WEBSTORE LINE ITEM SKU,WEBSTORE LINE ITEM ROW ID,OVERAGE ALLOWED
1.00,20-002028-01,,,"ISOLATOR, PUMP MOUNTING, WITH PSA",112,Vandell,No,104,No,EA,,2,,,3.00,US Dollar,1000 REV/COGS System,L3 : EXP Block,,,
3.00,20-002064-01,,,"GASKET, WET ZONE HEAT EXCHANGER SEAL",42,Vandell,No,26,No,EA,,3,,,12.50,US Dollar,1000 REV/COGS System,L3 : EXP Block,,,
4.00,20-002065-01,,,"GASKET, WET ZONE HEAT EXCHANGER SIDE SEALS",68,Vandell,No,52,No,EA,,4,,,12.50,US Dollar,1000 REV/COGS System,L3 : EXP Block,,,
6.00,30-001021-01,,,"SEAL, FOAM, ADHESIVE BACKED, RADIATOR",53,Vandell,No,52,No,EA,,5,,,9.72,US Dollar,1000 REV/COGS System,L3 : EXP Block,,,
7.00,30-001022-01,,,"ISOLATOR, RADIATOR, FOAM, SOFT SILICONE, WITH PSA",112,Vandell,No,104,No,EA,,6,,,2.50,US Dollar,1000 REV/COGS System,L3 : EXP Block,,,
8.00,30-001023-01,,,"GASKET, ENVIRONMENTAL, MANIFOLD BULKHEAD",26,Vandell,No,26,No,EA,,7,,,15.00,US Dollar,1000 REV/COGS System,L3 : EXP Block,,,
9.00,30-001025-01,,,"SEAL, FOAM, EPDM, ADHESIVE BACKED, AUX RADIATOR HEADER PIPES",57,Vandell,No,52,No,EA,,8,,,5.00,US Dollar,1000 REV/COGS System,L3 : EXP Block,,,
